{
  "$schema": "https://json-schema.org/draft/2020-12/schema",
  "$id": "https://github.com/samtak-svf/icelandic-social/identifiers/ids.schema.json",
  "title": "Frozen identifiers",
  "description": "Every identifier that cannot be renamed after first use. Neutral by rule: no value may contain a brand leak term (tooling/brand-leak-guard.mjs). A change needs the matching ids.lock.json edit and a decision record in the same pull request (tooling/ids-freeze.mjs).",
  "type": "object",
  "additionalProperties": false,
  "required": ["$schema", "store", "identity", "cloudflare", "hosts", "services", "appleInterim"],
  "$defs": {
    "reverseDns": { "type": "string", "pattern": "^[a-z][a-z0-9]*(\\.[a-z][a-z0-9]*)+$" },
    "slug": { "type": "string", "pattern": "^[a-z][a-z0-9-]*[a-z0-9]$" },
    "className": { "type": "string", "pattern": "^[A-Z][A-Za-z0-9]*$" },
    "host": { "type": "string", "pattern": "^[a-z0-9-]+(\\.[a-z0-9-]+)+$" },
    "fileName": { "type": "string", "pattern": "^[a-z][a-z0-9-]*\\.db$" },
    "channelId": { "type": "string", "pattern": "^[a-z][a-z0-9_]*$" },
    "appGroup": { "type": "string", "pattern": "^group\\.[a-z][a-z0-9]*(\\.[a-z][a-z0-9]*)+$" },
    "appleTeamId": { "type": "string", "pattern": "^[A-Z0-9]{10}$" },
    "kenniClientId": { "type": "string", "pattern": "^@innskraning\\.is/[a-z][a-z0-9-]*$" },
    "callbackPath": { "type": "string", "pattern": "^/auth/[a-z]+/callback$" }
  },
  "properties": {
    "$schema": { "const": "./ids.schema.json" },
    "store": {
      "type": "object",
      "additionalProperties": false,
      "required": [
        "androidApplicationId",
        "iosBundleId",
        "iosNotificationServiceBundleId",
        "appGroup",
        "keychainAccessGroup",
        "urlScheme",
        "androidNotificationChannels",
        "databaseFile"
      ],
      "properties": {
        "androidApplicationId": { "$ref": "#/$defs/reverseDns" },
        "iosBundleId": { "$ref": "#/$defs/reverseDns" },
        "iosNotificationServiceBundleId": { "$ref": "#/$defs/reverseDns" },
        "appGroup": { "$ref": "#/$defs/appGroup" },
        "keychainAccessGroup": { "$ref": "#/$defs/appGroup" },
        "urlScheme": { "$ref": "#/$defs/reverseDns" },
        "androidNotificationChannels": {
          "type": "object",
          "additionalProperties": false,
          "required": ["messages", "alerts"],
          "properties": {
            "messages": { "$ref": "#/$defs/channelId" },
            "alerts": { "$ref": "#/$defs/channelId" }
          }
        },
        "databaseFile": { "$ref": "#/$defs/fileName" }
      }
    },
    "identity": {
      "type": "object",
      "additionalProperties": false,
      "required": ["kenniClientId", "kenniWebClientId"],
      "properties": {
        "kenniClientId": { "$ref": "#/$defs/kenniClientId" },
        "kenniWebClientId": { "$ref": "#/$defs/kenniClientId" }
      }
    },
    "cloudflare": {
      "type": "object",
      "additionalProperties": false,
      "required": ["worker", "d1", "r2", "durableObjects", "jurisdiction"],
      "properties": {
        "worker": { "$ref": "#/$defs/slug" },
        "d1": { "$ref": "#/$defs/slug" },
        "r2": {
          "type": "object",
          "additionalProperties": false,
          "required": ["media", "artifacts", "profiles"],
          "properties": {
            "media": { "$ref": "#/$defs/slug" },
            "artifacts": { "$ref": "#/$defs/slug" },
            "profiles": { "$ref": "#/$defs/slug" }
          }
        },
        "durableObjects": {
          "type": "object",
          "additionalProperties": false,
          "required": ["conversation", "inbox", "space"],
          "properties": {
            "conversation": { "$ref": "#/$defs/className" },
            "inbox": { "$ref": "#/$defs/className" },
            "space": { "$ref": "#/$defs/className" }
          }
        },
        "jurisdiction": { "const": "eu" }
      }
    },
    "hosts": {
      "type": "object",
      "additionalProperties": false,
      "required": ["api", "link", "linkPathPrefix", "web", "webSignInCallbacks"],
      "properties": {
        "api": { "$ref": "#/$defs/host" },
        "link": { "$ref": "#/$defs/host" },
        "linkPathPrefix": { "type": "string", "pattern": "^/[a-z]+/$" },
        "web": { "$ref": "#/$defs/host" },
        "webSignInCallbacks": {
          "type": "object",
          "additionalProperties": false,
          "required": ["kenni", "google"],
          "properties": {
            "kenni": { "$ref": "#/$defs/callbackPath" },
            "google": { "$ref": "#/$defs/callbackPath" }
          }
        }
      }
    },
    "services": {
      "type": "object",
      "additionalProperties": false,
      "required": [
        "firebaseProjectId",
        "appleTeamId",
        "gcpSecretPrefix",
        "gcpSecretProject",
        "githubSlug"
      ],
      "properties": {
        "firebaseProjectId": { "type": "string", "pattern": "^[a-z][a-z0-9-]{4,28}[a-z0-9]$" },
        "appleTeamId": {
          "description": "null until Samtak svf.'s own Apple team exists (decision 0010)",
          "anyOf": [{ "$ref": "#/$defs/appleTeamId" }, { "type": "null" }]
        },
        "gcpSecretPrefix": { "type": "string", "pattern": "^[a-z][a-z0-9-]*-$" },
        "gcpSecretProject": { "$ref": "#/$defs/slug" },
        "githubSlug": { "type": "string", "pattern": "^[a-z0-9-]+/[a-z0-9-]+$" }
      }
    },
    "appleInterim": {
      "description": "TestFlight builds on another organisation's Apple team until Samtak svf.'s own exists (decision 0011). Its ids extend the frozen ones and never equal them, so the frozen ids stay free for Samtak svf.'s team (tooling/ids-freeze.mjs). null when there is no interim.",
      "anyOf": [
        {
          "type": "object",
          "additionalProperties": false,
          "required": ["teamId", "iosBundleId", "iosNotificationServiceBundleId", "appGroup"],
          "properties": {
            "teamId": { "$ref": "#/$defs/appleTeamId" },
            "iosBundleId": { "$ref": "#/$defs/reverseDns" },
            "iosNotificationServiceBundleId": { "$ref": "#/$defs/reverseDns" },
            "appGroup": { "$ref": "#/$defs/appGroup" }
          }
        },
        { "type": "null" }
      ]
    }
  }
}
