{
  "$schema": "./ids.schema.json",
  "store": {
    "androidApplicationId": "is.samtak.spjall",
    "iosBundleId": "is.samtak.spjall",
    "iosNotificationServiceBundleId": "is.samtak.spjall.notifications",
    "appGroup": "group.is.samtak.spjall",
    "keychainAccessGroup": "group.is.samtak.spjall",
    "urlScheme": "is.samtak.spjall",
    "androidNotificationChannels": {
      "messages": "messages",
      "alerts": "alerts"
    },
    "databaseFile": "spjall.db"
  },
  "identity": {
    "kenniClientId": "@innskraning.is/spjall",
    "kenniWebClientId": "@innskraning.is/spjall-web"
  },
  "cloudflare": {
    "worker": "spjall-api",
    "d1": "spjall-db",
    "r2": {
      "media": "spjall-media",
      "artifacts": "spjall-artifacts",
      "profiles": "spjall-profiles"
    },
    "durableObjects": {
      "conversation": "Conversation",
      "inbox": "Inbox",
      "space": "Space"
    },
    "jurisdiction": "eu"
  },
  "hosts": {
    "api": "spjall.samtak.is",
    "link": "spjall.samtak.is",
    "linkPathPrefix": "/l/",
    "web": "spjall.samtak.is",
    "webSignInCallbacks": {
      "kenni": "/auth/kenni/callback",
      "google": "/auth/google/callback"
    }
  },
  "services": {
    "firebaseProjectId": "samtak-spjall",
    "appleTeamId": null,
    "gcpSecretPrefix": "samtak-spjall-",
    "gcpSecretProject": "samtak-secrets",
    "githubSlug": "samtak-svf/icelandic-social"
  },
  "appleInterim": {
    "teamId": "B4724Z74TM",
    "iosBundleId": "is.samtak.spjall.beta",
    "iosNotificationServiceBundleId": "is.samtak.spjall.beta.notifications",
    "appGroup": "group.is.samtak.spjall.beta"
  }
}
